INPUT:text	INPUT:text_id	GOLDEN:is_correct
L'archéologue Michiko Intoh propose à la fin des années 1990 deux hypothèses. La première, qui a la faveur de la scientifique, est un déplacement depuis les îles Yap, à la lueur des vestiges archéologiques, d'un petit groupe humain qui adopte dans un second temps un langage venant de l'est, d'une nature totalement différente de celui de Yap. Une deuxième hypothèse, basée sur l'étude linguistique, propose une provenance depuis l'est du Pacifique des premières populations qui s'intègrent à des réseaux d'échanges avec les îles Yap. La première hypothèse ne convainc pas Paul Rainbird qui, en 2004, remarque que Fais est occupée bien après les îles voisines situées à l'ouest. Il pense que l'arrivée précoce des hommes à Fais tient à ce que la très grande majorité des atolls plus à l'est, qui ne sont occupés que quelques centaines d'années plus tard, n'étaient pas encore suffisamment émergés pour accueillir une population humaine. Quelques années plus tard, en 2011, Michiko Intoh ne propose plus qu'un mouvement humain en provenance de l'est conformément à l'approche linguistique, le mobilier archéologique témoignant des échanges avec l'ouest. Une étude des dermatoglyphes parue en 1972 n'a pas permis de distinguer des autres populations d'Océanie les populations d'Ulithi et de Fais, associées dans un même groupe par les chercheurs car partageant la même langue.	4309	yes
Après la mort, le corps n'est jamais autopsié. Le défunt est accompagné d'une multitude de cadeaux en tissu achetés par les membres de sa famille : des tapis tressés, des tissus fabriqués sur des métiers à tisser, des couvertures ou draps achetés en magasin. Ils accompagnent le corps comme objets funéraires ou pour envelopper le corps, ou sont remis à la famille. Le machi, marque de l'amour portée par une femme, une sœur ou une fille, est le plus apprécié des tissus funéraires et peut être réalisé par anticipation pour des parents âgés afin d'être disponible à temps,,. Au début du XXe siècle, le corps était partiellement peint avec du curcuma. Lors de l'enterrement, la filiation généalogique des personnes présentes est énumérée. La tombe peut être gardée pendant trois jours pour vérifier que l'esprit du mort est bien sur place et communiquer avec lui. Les biens du défunt qui n'ont pas été détruits ou récupérés avant la mort sont brûlés pour éviter que l'esprit reste près de sa maison. La famille reste quatre jours sans sortir de la maison endeuillée. La culture de quelques champs de taro du défunt peut être suspendue durant six mois en signe de respect. Le nom du défunt n'est plus prononcé jusqu'à ce qu'il soit donné à un nouveau-né de la famille en qui il est espéré retrouver le caractère de son homonyme.	4349	yes
Après la mise en place à partir de 2013 d'un régime autoritaire par le président Abdulla Yameen, élu en 2013, et l'invalidation de la candidature de l’ancien président déchu Mohamed Nasheed par la commission électorale, Ibrahim Mohamed Solih est désigné candidat du Parti démocrate pour l'élection présidentielle de 2018. Il est à la tête d'une coalition hétéroclite d'opposition. Celle-ci se compose du PDM, de la faction pro-Gayoom du PPM, du Parti républicain et du Parti de la justice. Solih prend alors Naseem comme colistier. Les médias ne couvrent pas la campagne électorale du binôme d'opposition, de crainte de représailles.	4368	yes
Elle est assez similaire à celle du faisan doré. En parade nuptiale, le mâle, collerette ouverte, poursuit inlassablement la femelle en courant, parfois même en sautant. Une fois arrivé à son niveau, il déploie au maximum le côté de sa collerette orienté vers elle, abaisse les ailes pour dévoiler son croupion gonflé et écarte légèrement la queue, mettant en valeur les larges rectrices bordées des sus-caudales rouge orangé. Tant que la femelle reste immobile (elle est souvent occupée à se nourrir) il garde cette posture mais en cas de fuite, il la poursuit à nouveau avec empressement, tourne sans cesse autour d’elle et tente de lui barrer le passage pour exhiber à nouveau sa collerette en éventail. Si elle s’enfuit à nouveau, il se retourne brusquement et répète son manège dans l’autre sens. Parfois il tente de poser une patte sur le dos de la poule ou de lui griffer les flancs jusqu’à ce qu’elle cède en adoptant une attitude de soumission provoquant immédiatement l’accouplement. La copulation terminée, il lance un bref sifflement d’excitation (Hennache & Ottaviani 2006).	4388	yes
L'île compte en 1909 un total de 34 familles, chiffre identique en 2007,. Chacun des trois villages compte dix familles ou plus comprenant de 3  à   15 membres. Les familles, agnatiques et patrilocales, possèdent généralement de trois à cinq bâtiments. Cet ensemble de constructions est désigné par le terme bogota également employé pour nommer la famille et les parcelles de terrain de premier niveau. La famille rassemble plusieurs frères ou agnats, leurs femmes —  qui conservent leurs droits sur l'héritage de leurs parents — et les enfants non mariés,, auxquels peut s'ajouter un parent veuf. Le statut de chaque personne dépend des biens patrilocaux. Avant la colonisation, les familles possédaient des connaissances spécialisées dans un domaine comme les rituels magiques associés à certaines techniques de pêche ou d'agriculture, la construction de canoë, la direction des danses, le tissage du machi. Les familles occupant un rang principal, c'est-à-dire la moitié d'entre elles, devaient chaque année fournir une variété spéciale de machi, le mmul au chef unique de l'île. Celui-ci le déposait sur une étagère aux esprits pendant quatre jours en offrande aux ancêtres avant de le ranger soigneusement.	4340	yes
La ville a été parfois touchée par des attentats à la bombe dans le cadre du conflit armé du Nord-Ouest du Pakistan qui a conduit à la recrudescence des attentats dans le pays, surtout depuis 2007. La ville de Faisalabad est relativement peu touchée en comparaison des autres grandes villes du pays. L'attaque la plus violente a lieu le 8 mars 2011 et coûte la vie à près de trente personnes. L'attaque visait une station essence située près de bâtiments de l'administration. Ces derniers n'ont pas été touchés mais l'explosion a provoqué d'importants dégâts, notamment à des locaux de la Pakistan International Airlines.	4371	yes
Dans la première année de ses activités commerciales, Jagriti avait réussi à faire paraître douze publications, dont l'œuvre acclamée par la critique, « Ami Birangona Bolchhi » (En tant qu'héroïne de guerre, je parle) de Nilima Ibrahim, qui raconte les histoires de femmes et de filles bengalies violées et torturées par des soldats pakistanais et leurs collaborateurs pendant la guerre de libération du Bangladesh en 1971. Le livre documente l'expérience horrible de la survie de ces femmes et filles dans les camps militaires pakistanais et jette un regard critique sur la structure sociale qu'elles ont eu du mal à retrouver après la fin de la guerre.	4366	yes
Le 30 mai 2015, SM Entertainment annonce que le groupe publiera son premier single japonais intitule Summer Special Pinocchio / Hot Summer, le 22 juillet 2015. Le single contiendra Pinocchio et Hot Summer et ne devrait pas avoir de nouvelles chansons,. Toutefois, le DVD contiendra les clips videos de ces deux chansons. Lors de l’evenement tenu a Osaka, pour la sortie du single, seules Krystal, Luna et Amber etaient presentes,. Victoria etait absente due a sa sante, ses ac. 	9	no
L'île est positionnée à l'extrémité ouest de la plaque des Carolines, de mouvement ouest-nord-ouest, et qui se dirige vers la plaque philippine au bord oriental de laquelle sont situées les îles Yap. Fais est apparue à la suite de la rencontre entre ces plaques au Cénozoïque ancien, peut-être plus précisément durant le Miocène, il y a environ 24 millions d'années. Les scientifiques ne savent pas si les deux plaques sont toujours en collision ou si la plaque des Carolines a commencé à passer au-dessous de celle des Philippines. L'île est localisée sur la partie nord de la dorsale des Carolines, séparée de la partie sud par la fosse océanique de Sorol.	4297	yes
Durant la guerre de Sécession, une diligence nordiste est attaquée par trois soldats sudistes. Les passagers sont tués. Ignorant que les hostilités étaient sur le point de prendre fin, Tom Dooley et ses deux camarades sont alors devenus des assassins. Voulant échapper à la potence, Dooley prend la fuite en entraînant la jolie Laura Foster dont il est amoureux. Mais la jeune femme est également courtisée par Charlie Grayson. Celui-ci se joint aux militaires et civils pour appréhender les trois fugitifs et surtout se débarrasser de son rival en amour...	4362	yes
D'abord baptise F-Zero 64, le jeu a ete revele par le magazine Famitsu a la mi-1997. Plusieurs programmeurs de Wave Race 64, dont le programmeur principal, ont fait partie de l'equipe de developpement de F-Zero X,. Le public a pu tester le titre pour la premiere fois au Nintendo Space World de novembre 1997,. D'apres GameSpot, F-Zero X est devenu le premier jeu de course a fonctionner a 60 images par seconde, avec jusqu'a 30 vehicules a l'ecran. Cependant, pour garantir cette fluidite, Nintendo a du sacrifier le nombre de polygones par vehicule, la qualite des textures et le detail des circuits. La sortie nord-americaine de F-Zero X a ete retardee de trois mois en raison de la politique de Nintendo of America qui etait d'espacer uniformement les sorties de jeux Nintendo. Le titre etait concu pour etre compatible avec le Nintendo 64DD, mais cette fonctionnalite ne fut pas exploitee en dehors du Japon a cause de l'echec commercial du 64DD.	40	yes
En hiver il fréquente les zones basses, découvertes le long des fleuves, en bordure de forêts caduques, ou encore les cultures. Au printemps il gagne les forêts caduques de moyenne altitude, de préférence en lisière, et en été il reste dans les forêts mixtes à strate arbustive basse. Différentes analyses réalisées sur plusieurs sites ont démontré la constance de ces exigences. Les faisans dorés vivent à plus basse altitude que le faisan de Lady Amherst ; ils dépassent rarement 1 500 m alors que le second atteint 3 000 m.	4400	yes
L'utilisation du boost et des attaques est differente selon les opus successifs. Les episodes puristes (F-Zero, F-Zero Grand Prix 2 ou BS F-Zero et F-Zero Maximum Velocity) permettent de booster une seule fois par tour effectue. Lors de l'enclenchement du boost le vaisseau depasse sa vitesse maximale normale pendant 5 secondes puis ralentit. Tous les autres episodes permettent de booster a volonte des le debut du deuxieme tour. Le boost est alors une franche acceleration de courte duree. Toutefois chaque coup de boost entame la barre d'energie. Celle-ci peut alors se recharger en pilotant dans les zones de recharges qui sont signifiees par des barres colorees se trouvant sur le circuit.	27	yes
La saison 5 comprend 8 épisodes, elle est tournée pour l'essentiel à Sèvres d'avril à août 2012 ; plusieurs scènes ont, par ailleurs, été tournées au Québec. Sa diffusion a débuté le mercredi 7 novembre 2012 sur France 2. Dans cette saison Fabienne Lepic part au Québec pour représenter sa municipalité trois semaines durant. Renaud Lepic se rapproche de Tatiana, à tel point qu'en rentrant du Québec sa femme croit qu'il a eu une aventure avec elle. Il devient numéro 1 de chez Binet, d'abord par intérim puis de manière définitive mais il se rendra compte que ce poste n'est pas fait pour lui. Les relations de Tiphaine et Christophe sont compliquées : dans le premier épisode, Christophe rompt avec Tiphaine lors des fiançailles à la médiévale...	4358	yes
Felice Della Pietà est un homme modeste et peu fortuné qui a épousé en secondes noces Adelaide. Ils élèvent Veronica née du premier mariage de Felice avec Silvia qui s'est suicidée, noyée dans un fleuve. Felice qui ne s'est pas résigné de la perte de Silvia retourne où celle-ci s'est suicidée et commence à parler à sa tombe. D'une façon tout à fait inattendue, Silvia réapparaît et lui révèle avoir mis sa disparition en scène afin de le quitter, car lassée par sa vie miséreuse et simple avec Felice à Venise. Elle a décidé néanmoins de revenir par amour pour Felice.	4363	yes
F-Zero est une serie de jeu de course futuriste, tres populaires dans la galaxie, mettant en scene des vehicules extremement rapides levitant a quelques centimetres au-dessus du sol et disputant des Grand Prix ou tous les coups sont permis sur des circuits aux traces complexes. La competition de F-Zero se deroule dans un univers fictif (incluant la Terre et la ville de New York rebaptisee Mute City) prenant place au XXVIIe siecle (annees 2560) et succede aux Grand Prix F-Max. Le personnage principal, Captain Falcon, deviendra plus tard une des figures emblematiques de l'univers Nintendo	25	yes
On distingue généralement les faisanderies sauvages des faisanderies d’élevage. Les faisans sont soit sauvages, soit domptés et dociles. Le terme utilisé dans les anciens actes germanophones pour Saverne parlent clairement d’une « wilde Fasanerie », donc sauvage. Le faisandier ne s’immisce pas trop dans la vie des faisans qui sont pour une grande part  livrés à eux-mêmes. En revanche, il doit veiller à écarter les prédateurs naturels des volatiles. C’est là sa tâche principale. Le faisandier cumule les casquettes car il est le plus souvent attaché au  service des forêts. Dans le domaine de chasse épiscopal de Saverne, il porte le titre de « brigadier-forestier  de la forêt de la Faisanderie »La faisanderie épiscopale répondait  aux critères   de rentabilité qu’on attend d’un tel domaine de chasse à tir :	4425	no
Inspirée de faits réels, vécus, chaque jour, par des millions de parents et d’enfants, cette série, tournée dans des décors naturels à la manière d’un « docu-soap », suit le quotidien de deux familles déjantées pendant toute une année scolaire. Lepic ou Bouley, ils sont des parents immatures, névrosés et angoissés par leurs responsabilités.De la rentrée des classes, en passant par l'arrivée des poux, le week-end chez papi et mamie, le choix des activités, l'arrivée des premiers bulletins scolaires, la drogue, la classe verte, etc. : dur, dur d'être parents !	4356	no
L'eau potable est préférentiellement fournie par les noix de coco, mais l'eau de pluie tombant sur les toits des bâtiments est également récupérée à cet effet et stockée dans des réservoirs. Une noix de coco a une contenance d'environ 300 ml d'eau chargée d'électrolytes et un habitant en consomme trois à cinq par jour. Il peut compléter cet apport en eau et en nutriments en mangeant des papayes, des citrons ou autres productions d'arbres fruitiers. Outre pour la consommation humaine, l'eau de pluie est également employée pour la cuisine, la vaisselle, la lessive et le rinçage après les bains de mer. Le bord de mer sert pour le lavage du corps et l'élimination des déchets humains, il n'y a donc pas de douche ou de toilettes. L'eau de pluie stockée dans les réservoirs est très peu utilisée pour l'agriculture et seulement pour l'alimentation des porcs.	4327	yes
Les critiques s'accordent generalement a dire que F-Zero est desormais un standard des jeux de courses et qu'il est l'une des principales references a l'origine du sous-genre des jeux de courses futuristes. Le titre a ete loue par les critiques pour son gameplay rapide et difficile, son grand nombre de circuits, et l'utilisation du Mode 7. Cette technique de rendu graphique representait a l'epoque un accomplissement technologique innovant rendant les jeux de courses plus realistes, le premier d'entre eux etant F-Zero. Le titre a par consequent revigore le genre et inspire la creation de nombreux jeux de courses. Les critiques retrospectives sur le jeu font valoir qu'il aurait gagne a beneficier d'un mode multijoueur.	30	yes
L'île ne possède pas de gisements d'argile et les céramiques nécessaires aux activités culinaires ont donc été importées. Les fouilles ont fourni, dès les niveaux les plus anciens, de nombreux tessons de céramique fabriquée aux îles Yap et quelques tessons de céramique des Palaos résultant peut-être d'échanges avec Yap. L'évolution dans le temps des types de céramique produits aux îles Yap est identique à celle observée à Fais, démontrant des contacts très rapprochés,,,. Les fouilles ont également mis au jour des pierres en schiste vert en provenance des îles Yap. Elles étaient probablement utilisées, après chauffe, pour faire bouillir l'eau. Des herminettes obtenues avec une coquille du genre Tridacna sont attestées depuis l'origine de l'occupation humaine. Celles en coquille du genre Cassis sont connues à partir de 800. Des tiges de leurre de pêche à la traîne et des hameçons en os ou en carapace de tortue ont pour certains été fabriqués sur place. D'autres datés entre 450 et 750 et entre 1050 et 1400 proviennent des îles Salomon ou des îles Marshall. Des ornements — un bracelet et un pendentif — en coquillage majoritairement du genre Tridacna, mais aussi des genres Cassis et Spondylus ont été retrouvés, de même que des fragments de carapace de tortue travaillés, des dents de requin percées, des ossements d'oiseaux consommés, etc., et, dans un niveau daté entre 1000 et 1200, de la gomme d'un arbre courant aux Philippines,.	4310	no
En matière de mesures de conservation, il serait souhaitable d’accorder le statut de zone protégée aux sites occupés par le faisan d’Elliot et de recenser annuellement ses populations. Il serait, en outre, important de mener une étude approfondie afin de déterminer ses exigences écologiques dans les différents types de forêts fréquentés. La législation chinoise devrait aussi être renforcée pour éviter le braconnage et le bûcheronnage illégal dans les zones protégées. Le Pheasant Specialist Group recommande aussi que la population captive soit gérée de façon optimale afin de maintenir une certaine diversité génétique.	4378	yes
La gestion des forêts publiques en Alsace est basée sur des schémas régionaux d'aménagement forestier en faveur de la biodiversité. Outre les actions ordinaires visant à conserver une trame intraforestière de vieux bois, l’accent est mis sur la création d'Îlots de vieillissement et de sénescence. Des îlots de vieillissement ont été créés dans la forêt de la Faisanderie au moment du déclassement de forêt de protection d’une partie de la forêt pour permettre l’extension du site industriel de l’entreprise « Kuhn 2 » . Des panneaux informent les promeneurs qu’« en contrepartie de l’autorisation de défricher le site de la Faisanderie pour l’extension de l’entreprise KUHN, des engagements forts ont été pris par la Communauté de Communes de la région de Saverne, pour le maintien des espaces forestiers. Ces engagements se traduisent par la création de boisement de compensation (25 ha), le maintien d’une bande boisée autour du site de la Faisanderie, le classement en Forêt de Protection du reste du massif plus de 500 ha et la création de trois îlots de vieillissement (plus de 6 ha) ».	4422	yes
Le 1er janvier 1528, une expédition espagnole dirigée par Álvaro de Saavedra s'arrête sur un groupe d'îles qu'il nomme las Islas de los Reyes (les « îles des Rois Mages » en français). Cet ensemble correspondrait aux îles Yap et à Fais,. Cette identification n'est pas partagée par Paul Rainbird qui attribue la première visite de Fais, quatorze ans plus tard, le 22 ou 23 janvier, à l'espagnol Ruy López de Villalobos qui y est accueilli en espagnol par des insulaires : la population locale s'approche des navires dans des canots et salue les marins avec des « Buenos días matelotes, ! » Cela pourrait être la résultante de la visite antérieure d'Álvaro de Saavedra ou de contacts avec des navires espagnols en provenance des Philippines,,. En 1808 ou 1809, le commerçant espagnol Jose Maria Fernandez qui souhaite atteindre les Palaos pour s'y fournir en holothuries arrive à Fais par erreur. Par la suite, l'expédition de l'explorateur Otto von Kotzebue, en 1815-1817, avec à son bord Adelbert von Chamisso y débarque, alors que Jules Dumont d'Urville qui arrive en vue de cette terre le 1er janvier 1828 ne fait que passer à proximité. Il la nomme Astrolabe avant de lui attribuer le nom de Feis, renseigné par le capitaine Lütcke que les insulaires l'appellent ainsi. En août de la même année, Louis Legoarant de Tromelin l'observe,.	4314	yes
F-Zero est un jeu de course futuriste ou les vehicules peuvent depasser les 400 km/h. Le joueur commence par choisir un des quatre pilotes proposes, chacun ayant des performances qui lui sont propres. Le but du jeu est alors d'arriver avant les autres pilotes a la ligne d'arrivee en evitant les pieges dissemines sur le circuit, tels que les mines, les zones glissantes ou les aimants. Chaque course demande au joueur d'effectuer cinq tours du circuit ; ce dernier doit terminer chaque tour avec une place minimale de plus en plus elevee sous peine d'etre disqualifie de la course. Il est necessaire qu'il termine la course au moins a la troisieme place s'il ne veut pas perdre de vie et devoir recommencer la piste. A chaque tour complete, le joueur est recompense par un bonus de vitesse d'environ quatre secondes, le « Super Jet », utilisable quand il le souhaite, ainsi qu'un nombre de points qui varie en fonction de sa place. Il peut stocker jusqu'a trois bonus de vitesse, dont la presence est indiquee par des icones verts en bas a droite de l'ecran. Une vie est offerte au joueur tous les 10 000 points.	31	yes
Wu (1994), lors d’une étude de terrain dans la Kuan Kuo Shi Nature Reserve, dans la province du Koueitchéou (centre-sud de la Chine), rapporte la découverte de 11 nids dont la ponte varie de cinq à sept œufs couvés par les femelles seules pendant 23 jours. Les mâles étaient habituellement appariés à deux femelles.Liang et al. (2002), dans une intéressante étude par radio-émetteurs, dans la réserve de Kuankuoshui (province de Guizhou), ont montré que les femelles quittaient très peu leur nid durant les 23 jours d’incubation ; une seule fois pour deux des femelles marquées. Les femelles couvant n’étaient pas du tout farouches ; les auteurs citent même le cas de poules qu’ils ont touchées durant la couvaison, sans que celles-ci ne s’envolent ou quittent même le nid, et qu’il fallait déplacer à la main puis remettre dans le nid à fin de vérification des œufs. Aucun mâle ne se trouvait dans le voisinage immédiat du nid.	4402	yes
Nina Janos est soulagée lorsque, rentrant prématurément d'une soirée costumée chez des amis, elle trouve un clown égorgé dans sa bibliothèque : elle pense être débarrassée de son mari, qu'elle qualifie de parfait salaud, et qui était censé être à Los Angeles pour ses affaires. Mais au démaquillage, il apparaît que la victime n'est que le bras droit de Ludovic Janos, Alton Chase. D’ailleurs, le mari - qui qualifie son épouse de nymphomane - est rentré chez lui bien vivant, au grand désespoir de l'éphémère veuve, qui avoue ne l'avoir épousé que pour son argent. Chez les amis, où la fête continue, Al Wheeler découvre qu'il y avait bien un clown au début de la soirée, et peut-être même deux. Dans un milieu où l'on mélange argent, alcool, sexe et haine, Ludovic Janos apparaît comme l'homme à abattre, celui que tout le monde jalouse et déteste. Mais ce n'est pas lui qui est mort...	4360	yes
Hennache et Ottaviani ont également observé des cas de parade latérale en captivité, où le mâle s’approche lentement de la femelle en émettant quelques gloussements. Puis  il se place sur l’un de ses côtés, les caroncules élargies, tout en déployant la queue et en gonflant amplement le plumage au point de paraître presque le double de sa taille. Le haut du dos et de la poitrine roux mordoré brille alors d’un vif éclat au soleil. Ainsi paré, il la regarde fixement et exhibe son casque argenté en baissant la tête, ainsi que son aile barrée qu’il laisse traîner au sol. Mais la femelle reste rarement immobile et à mesure qu’elle se déplace, il lui barre le chemin en recommençant son manège, la queue parfois tournée vers elle.	4376	yes
Marino et Marisa doivent se marier. C'est compter sans les ragots dénués de fondements qui sont rapportés à Marino... Celui-ci rompt alors les fiançailles. Quelques années plus tard, Marino est pris de regrets et tente de retrouver Marisa. Malheureusement, celle-ci a tenté de se suicider et est à l'hôpital... Elle a épousé un sourd-muet pour lequel elle n'éprouve pas d'amour et retrouve avec bonheur son premier fiancé. Le couple reformé tente de se débarrasser du mari. Celui-ci retrouve ses facultés et décide de devenir moine et c'est lui qui marie le couple...	4292	yes
